"Item type","Authors","Title","Publication year","Pages","Publisher","Address","Proceedings title","Conference location","Date published","ISBN","URLs","DOI","Abstract","Keywords","Sub-type","Series"
"Conference Paper","Farokhi S","Towards an SLA-Based Service Allocation in Multi-Cloud Environments","2014","591–594","IEEE Press","Chicago, Illinois","Proceedings of the 14th IEEE/ACM International Symposium on Cluster, Cloud, and Grid Computing","","2014","9781479927838","https://doi.org/10.1109/CCGrid.2014.62;http://dx.doi.org/10.1109/CCGrid.2014.62","10.1109/CCGrid.2014.62","Cloud computing popularity is growing rapidly and consequently the number of companies offering their services in the form of Software-as-a-Service (SaaS) or Infrastructure-as-a-Service (IaaS) is increasing. The diversity and usage benefits of the IaaS offers are encouraging SaaS providers to lease resources from the Cloud instead of operating their own data centers. This helps them to get rid of the maintenance overheads and better satisfy their customers which are more demanding in terms of service requirements nowadays. Such evolutionary tendency is leading to the emergence of new ways of service provisioning in which relying on infrastructure services of a single Cloud provider is not sufficient. Namely, the need of using Cloud services from multiple Clouds with various quality attributes and pricing models has been raised recently. Although service allocation based on Service Level Agreement (SLA) has been well investigated in Cloud computing so far, the new upcoming issues regarding to utilize multiple Clouds has led to new challenges. This paper looks at the service selection and allocation in a Multi-Cloud, as a delivery model of multiple Clouds, from the perspective of SaaS provider. The proposed framework assists SaaS providers to find suitable infrastructure services which best satisfy their requirements while handling SLA issues. We present an overview of the complete system and discus how the services are selected and the corresponding SLAs are monitored to detect the SLA violations.","InterCloud-SLA, service allocation, service level agreement (SLA), infrastructure-as-a-service (IaaS), software-as-a-service (SaaS), cloud computing, service selection, multi-cloud","","CCGRID '14"
"Conference Paper","Mihailescu M,Teo YM","On Economic and Computational-Efficient Resource Pricing in Large Distributed Systems","2010","838–843","IEEE Computer Society","USA","Proceedings of the 2010 10th IEEE/ACM International Conference on Cluster, Cloud and Grid Computing","","2010","9780769540399","https://doi.org/10.1109/CCGRID.2010.124;http://dx.doi.org/10.1109/CCGRID.2010.124","10.1109/CCGRID.2010.124","There is growing interest in large-scale systems where globally distributed and commoditized resources can be shared and traded, such as peer-to-peer networks, grids, and cloud computing. Users of these systems are rational and maximize their own interest when consuming and contributing shared resources, even if by doing so they affect the overall efficiency of the system. To manage rational users, resource pricing and allocation can provide the necessary incentives for users to behave such that the overall efficiency can be maximized. In this paper, we propose a dynamic pricing mechanism for the allocation of shared resources, and evaluate its performance. In contrast with several existing trading models, our scheme is designed to allocate a request with multiple resource types, such that the user does not have to aggregate different resource types manually. We formally prove the economic properties of our pricing scheme using the mechanism design framework. We perform both theoretical and simulation analysis to evaluate the economic and computational efficiency of the allocation and the scalability of the mechanism. Our simulations are validated against a prototype implementation on PlanetLab.","","","CCGRID '10"
"Conference Paper","Ge Y,Zhang Y,Qiu Q,Lu YH","A Game Theoretic Resource Allocation for Overall Energy Minimization in Mobile Cloud Computing System","2012","279–284","Association for Computing Machinery","New York, NY, USA","Proceedings of the 2012 ACM/IEEE International Symposium on Low Power Electronics and Design","Redondo Beach, California, USA","2012","9781450312493","https://doi.org/10.1145/2333660.2333724;http://dx.doi.org/10.1145/2333660.2333724","10.1145/2333660.2333724","Cloud computing and virtualization techniques provide mobile devices with battery energy saving opportunities by allowing them to offload computation and execute code remotely. When the cloud infrastructure consists of heterogeneous servers, the mapping between mobile devices and servers plays an important role in determining the energy dissipation on both sides. From an environmental impact perspective, any energy dissipation related to computation should be counted. To achieve energy sustainability, it is important reducing the overall energy consumption of the mobile systems and the cloud infrastructure. Furthermore, reducing cloud energy consumption can potentially reduce the cost of mobile cloud users because the pricing model of cloud services is pay-by-usage. In this paper, we propose a game-theoretic approach to optimize the overall energy in a mobile cloud computing system. We formulate the energy minimization problem as a congestion game, where each mobile device is a player and his strategy is to select one of the servers to offload the computation while minimizing the overall energy consumption. We prove that the Nash equilibrium always exists in this game and propose an efficient algorithm that could achieve the Nash equilibrium in polynomial time. Experimental results show that our approach is able to reduce the total energy of mobile devices and servers compared to a random approach and an approach which only tries to reduce mobile devices alone.","congestion game, game theory, virtualization, power management, mobile cloud computing","","ISLPED '12"
"Conference Paper","Imai S,Patterson S,Varela CA","Cost-Efficient Elastic Stream Processing Using Application-Agnostic Performance Prediction","2016","604–607","IEEE Press","Cartagena, Columbia","Proceedings of the 16th IEEE/ACM International Symposium on Cluster, Cloud, and Grid Computing","","2016","9781509024520","https://doi.org/10.1109/CCGrid.2016.89;http://dx.doi.org/10.1109/CCGrid.2016.89","10.1109/CCGrid.2016.89","Cloud computing adds great on-demand scalability to stream processing systems with its pay-per-use cost model. However, to promise service level agreements to users while keeping resource allocation cost low is a challenging task due to uncertainties coming from various sources, such as the target application's scalability, future computational demand, and the target cloud infrastructure's performance variability. To deal with these uncertainties, it is essential to create accurate application performance prediction models. In cloud computing, the current state of the art in performance modelling remains application-specific. We propose an application-agnostic performance modeling that is applicable to a wide range of applications. We also propose an extension to probabilistic performance prediction. This paper reports the progress we have made so far.","cloud computing, performance prediction, resource allocation","","CCGRID '16"
"Conference Paper","Al-Shishtawy A,Vlassov V","ElastMan: Autonomic Elasticity Manager for Cloud-Based Key-Value Stores","2018","115–116","Association for Computing Machinery","New York, NY, USA","Proceedings of the 22nd International Symposium on High-Performance Parallel and Distributed Computing","New York, New York, USA","2018","9781450319102","https://doi.org/10.1145/2462902.2462925;http://dx.doi.org/10.1145/2462902.2462925","10.1145/2462902.2462925","The increasing spread of elastic Cloud services, together with the pay-as-you-go pricing model of Cloud computing, has led to the need of an elasticity controller. The controller automatically resizes an elastic service in response to changes in workload, in order to meet Service Level Objectives (SLOs) at a reduced cost. However, variable performance of Cloud virtual machines and nonlinearities in Cloud services complicates the controller design. We present the design and evaluation of ElastMan, an elasticity controller for Cloud-based elastic key-value stores. ElastMan combines feedforward and feedback control. Feedforward control is used to respond to spikes in the workload by quickly resizing the service to meet SLOs at a minimal cost. Feedback control is used to correct modeling errors and to handle diurnal workload. We have implemented and evaluated ElastMan using the Voldemort key-value store running in a Cloud environment based on OpenStack. Our evaluation shows the feasibility and effectiveness of our approach to automation of Cloud service elasticity.","elasticity controller, cloud computing, key-value store","","HPDC '13"
"Conference Paper","Mian R,Martin P,Zulkernine F,Vazquez-Poletti JL","Estimating Resource Costs of Data-Intensive Workloads in Public Clouds","2012","","Association for Computing Machinery","New York, NY, USA","Proceedings of the 10th International Workshop on Middleware for Grids, Clouds and e-Science","Montreal, Quebec, Canada","2012","9781450316088","https://doi.org/10.1145/2405136.2405139;http://dx.doi.org/10.1145/2405136.2405139","10.1145/2405136.2405139","The promise of ""infinite"" resources given by the cloud computing paradigm has led to recent interest in exploiting clouds for large-scale data-intensive computing. In this paper, we present a model to estimate the resource costs for executing data-intensive workloads in a public cloud. The cost model quantifies the cost-effectiveness of a resource configuration for a given workload with consumer performance requirements expressed as SLAs, and is a key component of a larger framework for resource provisioning in clouds. We instantiate the cost model for the Amazon cloud, and experimentally evaluate the impact of key factors on the accuracy of the model.","cost model, resource provisioning, cloud computing","","MGC '12"
"Conference Paper","Al-Shishtawy A,Vlassov V","ElastMan: Autonomic Elasticity Manager for Cloud-Based Key-Value Stores","2013","115–116","Association for Computing Machinery","New York, NY, USA","Proceedings of the 22nd International Symposium on High-Performance Parallel and Distributed Computing","New York, New York, USA","2013","9781450319102","https://doi.org/10.1145/2493123.2462925;http://dx.doi.org/10.1145/2493123.2462925","10.1145/2493123.2462925","The increasing spread of elastic Cloud services, together with the pay-as-you-go pricing model of Cloud computing, has led to the need of an elasticity controller. The controller automatically resizes an elastic service in response to changes in workload, in order to meet Service Level Objectives (SLOs) at a reduced cost. However, variable performance of Cloud virtual machines and nonlinearities in Cloud services complicates the controller design. We present the design and evaluation of ElastMan, an elasticity controller for Cloud-based elastic key-value stores. ElastMan combines feedforward and feedback control. Feedforward control is used to respond to spikes in the workload by quickly resizing the service to meet SLOs at a minimal cost. Feedback control is used to correct modeling errors and to handle diurnal workload. We have implemented and evaluated ElastMan using the Voldemort key-value store running in a Cloud environment based on OpenStack. Our evaluation shows the feasibility and effectiveness of our approach to automation of Cloud service elasticity.","key-value store, cloud computing, elasticity controller","","HPDC '13"
"Conference Paper","An B,Lesser V,Irwin D,Zink M","Automated Negotiation with Decommitment for Dynamic Resource Allocation in Cloud Computing","2010","981–988","International Foundation for Autonomous Agents and Multiagent Systems","Richland, SC","Proceedings of the 9th International Conference on Autonomous Agents and Multiagent Systems: Volume 1 - Volume 1","Toronto, Canada","2010","9780982657119","","","We consider the problem of allocating networked resources in dynamic environment, such as cloud computing platforms, where providers strategically price resources to maximize their utility. Resource allocation in these environments, where both providers and consumers are selfish agents, presents numerous challenges since the number of consumers and their resource demand is highly dynamic. While numerous auction-based approaches have been proposed in the literature, this paper explores an alternative approach where providers and consumers automatically negotiate resource leasing contracts. Since resource demand and supply can be dynamic and uncertain, we propose a distributed negotiation mechanism where agents negotiate over both a contract price and a decommitment penalty, which allows agents to decommit from contracts at a cost. We compare our approach experimentally, using representative scenarios and workloads, to both combinatorial auctions and the fixed-price model used by Amazon's Elastic Compute Cloud, and show that the negotiation model achieves a higher social welfare.","cloud computing, negotiation strategy, automated negotiation","","AAMAS '10"
"Conference Paper","Li Z,Wu G","Optimizing VM Live Migration Strategy Based on Migration Time Cost Modeling","2016","99–109","Association for Computing Machinery","New York, NY, USA","Proceedings of the 2016 Symposium on Architectures for Networking and Communications Systems","Santa Clara, California, USA","2016","9781450341837","https://doi.org/10.1145/2881025.2881035;http://dx.doi.org/10.1145/2881025.2881035","10.1145/2881025.2881035","The live migration technology of virtual machine is very helpful for dynamic workload balance, server consolidation and fault tolerance in cloud computing environment. It is important to build live migration strategies which lead to low migration time, thus helping reduce migration cost while achieving migration goal. So we look into the topic of building a model to quantitatively predict live migration time. We thoroughly analyze the key parameters that affect the migration time and construct a live migration time cost model based on KVM. The evaluation of time cost model shows that the average prediction accuracy is above 90% in comparison with measured time. Based on time cost model, we propose 2 optimized live migration strategies for different application scenarios, one for load balance and fault tolerance, the other for server consolidation. The evaluation shows our optimized migration strategies can save 35% 50% of cost compared to the random migration strategy. We believe this should be the first comprehensive study of optimizing live migration strategy with migration time cost as a key factor.","live migration, time cost model, migration strategy","","ANCS '16"
"Conference Paper","Kang DK,Kim SH,Youn CH,Chen M","Cost Adaptive Workflow Scheduling in Cloud Computing","2014","","Association for Computing Machinery","New York, NY, USA","Proceedings of the 8th International Conference on Ubiquitous Information Management and Communication","Siem Reap, Cambodia","2014","9781450326445","https://doi.org/10.1145/2557977.2558079;http://dx.doi.org/10.1145/2557977.2558079","10.1145/2557977.2558079","In cloud computing, it remains a challenge to allocate virtualized resource with financial cost minimization and acceptable Quality of Service assurance. In general, the VM instance is allocated to cloud service users based on not actual job processing time but the fixed resource allocation time predetermined by cloud pricing policy in contrast to grid environment. In this case, the unnecessary cost dissipation is occurred by the wasted partial instance hours of allocated resource. To address this problem, we propose the heuristic based workflow scheduling scheme considering cloud-pricing model in this paper. Our scheme is composed of two phases: VM packing and MRSR (Multi Requests to Single Resource) phases. In VM-packing phase, preassigned multi tasks are aggregated into the common VM instance sequentially, and these tasks are merged in parallel by MRSR phase. By using our proposed schemes, we are able to reduce the number of required VM instances and achieve the significant cost saving while we guarantee the user's SLA (Service Level Agreement) in terms of workflow deadline. Our proposed schemes cannot only reduce the cost by 30% compared to traditional workflow scheduling schemes but also assure user's SLA.","cloud resource management, workflow scheduling, virtual machine allocation","","ICUIMC '14"
"Conference Paper","Gmach D,Rolia J,Cherkasova L","Selling T-Shirts and Time Shares in the Cloud","2012","539–546","IEEE Computer Society","USA","Proceedings of the 2012 12th IEEE/ACM International Symposium on Cluster, Cloud and Grid Computing (Ccgrid 2012)","","2012","9780769546919","https://doi.org/10.1109/CCGrid.2012.68;http://dx.doi.org/10.1109/CCGrid.2012.68","10.1109/CCGrid.2012.68","Cloud computing has emerged as a new and alternative approach for providing computing services. Customers acquire and release resources by requesting and returning virtual machines to the cloud. Different service models and pricing schemes are offered by cloud service providers. This can make it difficult for customers to compare cloud services and select an appropriate solution. Cloud Infrastructure-as-a-Service vendors offer a t-shirt approach for Virtual Machines (VMs) on demand. Customers can select from a set of fixed size VMs and vary the number of VMs as their demands change. Private clouds often offer another alternative, called time-sharing, where the capacity of each VM is permitted to change dynamically. With this approach each virtual machine is allocated a dynamic amount of CPU and memory resources over time to better utilize available resources. We present a tool that can help customers make informed decisions about which approach works most efficiently for their workloads in aggregate and for each workload separately. A case study using data from an enterprise customer with 312 workloads demonstrates the use of the tool. It shows that for the given set of workloads the t-shirt model requires almost twice the number of physical servers as the time share model. The costs for such infrastructure must ultimately be passed on to the customer in terms of monetary costs or performance risks. We conclude that private and public clouds should consider offering both resource sharing models to meet the needs of customers.","resource sharing, virtual machine sizing, cloud service models, virtualization, data center efficiency","","CCGRID '12"
"Conference Paper","Al-Shishtawy A,Vlassov V","ElastMan: Elasticity Manager for Elastic Key-Value Stores in the Cloud","2013","","Association for Computing Machinery","New York, NY, USA","Proceedings of the 2013 ACM Cloud and Autonomic Computing Conference","Miami, Florida, USA","2013","9781450321723","https://doi.org/10.1145/2494621.2494630;http://dx.doi.org/10.1145/2494621.2494630","10.1145/2494621.2494630","The increasing spread of elastic Cloud services, together with the pay-as-you-go pricing model of Cloud computing, has led to the need of an elasticity controller. The controller automatically resizes an elastic service in response to changes in workload, in order to meet Service Level Objectives (SLOs) at a reduced cost. However, variable performance of Cloud Virtual Machines and nonlinearities in Cloud services, such as the diminishing reward of adding a service instance with increasing the scale, complicates the controller design. We present the design and evaluation of ElastMan, an elasticity controller for Cloud-based elastic key-value stores. ElastMan combines feedforward and feedback control. Feedforward control is used to respond to spikes in the workload by quickly resizing the service to meet SLOs at a minimal cost. Feedback control is used to correct modeling errors and to handle diurnal workload. To address nonlinearities, our design of ElastMan leverages the near-linear scalability of elastic Cloud services in order to build a scale-independent model of the service. We have implemented and evaluated ElastMan using the Voldemort key-value store running in an OpenStack Cloud environment. Our evaluation shows the feasibility and effectiveness of our approach to automation of Cloud service elasticity.","feedforward control, SLO, cloud computing, elasticity controller, feedback control, cloud storage","","CAC '13"
"Conference Paper","Karatza H","Large Scale Real-Time Distributed Systems – Resource Allocation and Scheduling Issues","2021","","Association for Computing Machinery","New York, NY, USA","7th Conference on the Engineering of Computer Based Systems","Novi Sad, Serbia","2021","9781450390576","https://doi.org/10.1145/3459960.3461561;http://dx.doi.org/10.1145/3459960.3461561","10.1145/3459960.3461561","Due to the advances in networks and computing systems, many aspects of our daily life depend on distributed interconnected computing resources. Large-scale distributed systems offer computational services to scientists, consumers and enterprises. Efficient management of distributed resources is crucial to use effectively the power of these systems and achieve good performance. Large-scale distributed systems are usually real-time as they are used for serving applications which require real-time processing. It is essential that appropriate resource allocation and scheduling techniques are utilized ensuring timeliness. Cloud computing, as a large-scale distributed computing paradigm based on a pay-as-you-go pricing model, has been extensively used for the deployment of complex computationally intensive applications. Particularly important in cloud computing is to run delay-sensitive applications. This can be achieved due to cloud’s high-performance computing capabilities for real-time execution. However, approaches to resolve other issues such as cost and energy conservation are necessary. In the last years, there is an expansion of the Internet of Things (IoT). There is a plethora of IoT applications which generate huge amounts of data and it is important to process these data in real-time and provide fast decisions. As a result, fog computing has emerged as a computing model which extends the cloud to the edge of the network, thus reducing the latency of IoT data transmission. The computational capacity of fog resources is usually limited, therefore it is necessary to employ algorithms that involve the collaboration between the cloud and fog resources. Consequently, appropriate scheduling of time-sensitive applications is required to exploit the capacity of cloud and fog computing so that the workload’s deadlines are met. In this keynote, we will present and discuss various aspects of large-scale real-time distributed systems, from the perspective of resource allocation and scheduling and we will conclude with future directions in this research area.","scheduling, large-scale distributed systems, real-time systems","","ECBS 2021"
"Conference Paper","Georgoulakis Misegiannis M,Kantere Vverena,d'Orazio L","Multi-Objective Query Optimization in Spark SQL","2022","70–74","Association for Computing Machinery","New York, NY, USA","Proceedings of the 26th International Database Engineered Applications Symposium","Budapest, Hungary","2022","9781450397094","https://doi.org/10.1145/3548785.3548800;http://dx.doi.org/10.1145/3548785.3548800","10.1145/3548785.3548800","Query optimization is a challenging process of DBMSs. When tackling query optimization in the cloud, there exists a simultaneous need of providing an optimal physical query execution plan, as well as an optimal resource configuration among available ones. Cloud computing features like resource elasticity and pricing make the process of finding this optimal query plan a multi-objective problem, with the monetary cost being an equally important factor to query execution time. Apache Spark is a popular choice for managing big data in the cloud. However, query optimization in its SQL module (Spark SQL) involves a number of limitations due to the rule-based nature of its optimizer, Catalyst. We propose a multi-objective cost model for the extension of the query optimizer of Apache Spark, aiming to minimize both objectives of query execution time and monetary cost, as well as a methodology for exploring the space of Pareto-optimal query plans and selecting one. The cost model is implemented and tuned, and an experimental study is conducted to validate its accuracy.","Catalyst optimizer, multi-objective optimization, query optimization, cloud computing, cost model, Apache Spark","","IDEAS '22"
