"Item type","Authors","Title","Publication year","Pages","Publisher","Address","Proceedings title","Conference location","Date published","ISBN","URLs","DOI","Abstract","Keywords","Sub-type","Series"
"Conference Paper","Mihailescu M,Teo YM","The Impact of User Rationality in Federated Clouds","2012","620–627","IEEE Computer Society","USA","Proceedings of the 2012 12th IEEE/ACM International Symposium on Cluster, Cloud and Grid Computing (Ccgrid 2012)","","2012","9780769546919","https://doi.org/10.1109/CCGrid.2012.127;http://dx.doi.org/10.1109/CCGrid.2012.127","10.1109/CCGrid.2012.127","With cloud computing, the long-envisioned dream of computing as utility is achieved. Many of the current standalone cloud providers offer resources and services using pay-per-use fixed pricing. Spot pricing, recently introduced in Amazon EC2, is more efficient by setting the resource price dynamically, based on demand. However, this pricing scheme, similar to the uniform price auction, is truthful only when supply can be adjusted, such as the case of a standalone cloud provider. In a federated cloud, where resources from multiple cloud providers are integrated to increase elasticity and reliability, rational users can have a greater impact. In this paper, we evaluate the impact of rationality in a federated cloud, by comparing the consumer welfare achieved by spot pricing, currently used in Amazon EC2, and a strategy-proof pricing scheme. We consider different EC2 regions as providers in a federated cloud, and use traces of spot prices to determine the consumer requests and the user welfare. Our results show that spot pricing is not suitable in a federated cloud, where rational users can increase their welfare by being untruthful.","spot pricing, cloud computing, rationality, federated clouds","","CCGRID '12"
"Conference Paper","Al-Dulaimy A,Taheri J,Papadopoulos AV,Nolte T","LOOPS: A Holistic Control Approach for Resource Management in Cloud Computing","2021","117–124","Association for Computing Machinery","New York, NY, USA","Proceedings of the ACM/SPEC International Conference on Performance Engineering","Virtual Event, France","2021","9781450381949","https://doi.org/10.1145/3427921.3450254;http://dx.doi.org/10.1145/3427921.3450254","10.1145/3427921.3450254","In cloud computing model, resource sharing introduces major benefits for improving resource utilization and total cost of ownership, but it can create technical challenges on the running performance. In practice, orchestrators are required to allocate sufficient physical resources to each Virtual Machine (VM) to meet a set of predefined performance goals. To ensure a specific service level objective, the orchestrator needs to be equipped with a dynamic tool for assigning computing resources to each VM, based on the run-time state of the target environment. To this end, we present LOOPS, a multi-loop control approach, to allocate resources to VMs based on the service level agreement (SLA) requirements and the run-time conditions. LOOPS is mainly composed of one essential unit to monitor VMs, and three control levels to allocate resources to VMs based on requests from the essential node. A tailor-made controller is proposed with each level to regulate contention among collocated VMs, to reallocate resources if required, and to migrate VMs from one host to another. The three levels work together to meet the required SLA. The experimental results have shown that the proposed approach can meet applications' performance goals by assigning the resources required by cloud-based applications.","VM migration, resource management, cloud computing, vertical scaling, horizontal scaling, auto-scaling","","ICPE '21"
"Conference Paper","Chen S,Wang Y,Pedram M","Concurrent Placement, Capacity Provisioning, and Request Flow Control for a Distributed Cloud Infrastructure","2014","","European Design and Automation Association","Leuven, BEL","Proceedings of the Conference on Design, Automation & Test in Europe","Dresden, Germany","2014","9783981537024","","","Cloud computing and storage have attracted a lot of attention due to the ever increasing demand for reliable and cost-effective access to vast resources and services available on the Internet. Cloud services are typically hosted in a set of geographically distributed data centers, which we will call the cloud infrastructure. To minimize the total cost of ownership of this cloud infrastructure (which accounts for both the upfront capital cost and the operational cost of the infrastructure resources), the infrastructure owners/operators must do a careful planning of data center locations in the targeted service area (for example the US territories), data center capacity provisioning (i.e., the total CPU cycles per second that can be provided in each data center). In addition, they must have flow control policies that will distribute the incoming user requests to the available resources in the cloud infrastructure. This paper presents an approach for solving the unified problem of data center placement and provisioning, and request flow control in one shot. The solution technique is based on mathematical programming. Experimental results, using Google cluster data and placement/provisioning of up to eight data center sites demonstrate the cost savings of the proposed problem formulation and solution approach.","","","DATE '14"
"Conference Paper","Blocq G,Bachrach Y,Key P","The Shared Assignment Game and Applications to Pricing in Cloud Computing","2014","605–612","International Foundation for Autonomous Agents and Multiagent Systems","Richland, SC","Proceedings of the 2014 International Conference on Autonomous Agents and Multi-Agent Systems","Paris, France","2014","9781450327381","","","We propose an extension to the Assignment Game [37] in which sellers provide indivisible heterogeneous goods to their buyers. Each good takes up various amounts of resources and each seller has capacity constraints with respect to the total amount of resources it can provide. Hence, the total amount of goods that the seller can provide is dependent on the set of buyers. In this model, we first demonstrate that the core is empty and proceed to suggest a fair allocation of the resulting utility of an optimal match, using the Shapley value. We then examine scenarios where the worth and resource demands of each good are private information of selfish buyers and consider ways in which they can manipulate the system. We show that such Shapley value manipulations are bounded in terms of the gain an agent can achieve by using them. Finally, since this model can be of use when considering elastic resource allocation and utility sharing in cloud computing domains, we provide simulation results which show our approach maximizes welfare and, when used as a pricing scheme, can also increase the revenue of the cloud server providers over what is achieved with the widely-used fixed pricing scheme.","shapley value, cloud pricing, assignment game","","AAMAS '14"
"Conference Paper","Arabnejad V,Bubendorfer K,Ng B","Deadline Distribution Strategies for Scientific Workflow Scheduling in Commercial Clouds","2016","70–78","Association for Computing Machinery","New York, NY, USA","Proceedings of the 9th International Conference on Utility and Cloud Computing","Shanghai, China","2016","9781450346160","https://doi.org/10.1145/2996890.2996905;http://dx.doi.org/10.1145/2996890.2996905","10.1145/2996890.2996905","Commercial clouds have become a viable platform for performing a significant range of large scale scientific analyses - due to the offerings of elasticity, specialist hardware, software infrastructure and pay-as-you-go cost model. Such clouds represent a low upfront capital cost alternative to the use of dedicated eScience infrastructure. However, there are still significant technical hurdles associated with obtaining the best performance for the cost - it is easy to provision commercial clouds inefficiently resulting in great and potentially unanticipated expense.In this paper we introduce a new heuristic scheduling algorithm Deadline Distribution Ratio (DDR) to address the workflow scheduling problem with the objectives of minimizing the cost of Cloud computing resources while satisfying a given deadline. Within this context, we also investigate a range of different deadline distribution strategies and their effect on the overall scheduling performance. We then compare the DDR algorithm against three other published algorithms, using five different scientific workflows generated using the pegasus workflow generator, on a CloudSim simulation that implements a pricing model based on AWS. In general, the DDR algorithm returns the lowest costs across the majority of deadlines and workflows, while maintaining a high scheduling success rate.","cloud computing, scheduling, deadline distribution, scientific workflow","","UCC '16"
"Conference Paper","Henzinger TA,Singh AV,Singh V,Wies T,Zufferey D","A Marketplace for Cloud Resources","2010","1–8","Association for Computing Machinery","New York, NY, USA","Proceedings of the Tenth ACM International Conference on Embedded Software","Scottsdale, Arizona, USA","2010","9781605589046","https://doi.org/10.1145/1879021.1879022;http://dx.doi.org/10.1145/1879021.1879022","10.1145/1879021.1879022","Cloud computing is an emerging paradigm aimed to offer users pay-per-use computing resources, while leaving the burden of managing the computing infrastructure to the cloud provider. We present a new programming and pricing model that gives the cloud user the flexibility of trading execution speed and price on a per-job basis. We discuss the scheduling and resource management challenges for the cloud provider that arise in the implementation of this model. We argue that techniques from real-time and embedded software can be useful in this context.","worst-case execution time, cloud computing, iaas, large-scale scheduling, pricing models","","EMSOFT '10"
"Conference Paper","Tirado JM,Higuero D,Isaila F,Carretero J","Predictive Data Grouping and Placement for Cloud-Based Elastic Server Infrastructures","2011","285–294","IEEE Computer Society","USA","Proceedings of the 2011 11th IEEE/ACM International Symposium on Cluster, Cloud and Grid Computing","","2011","9780769543956","https://doi.org/10.1109/CCGrid.2011.49;http://dx.doi.org/10.1109/CCGrid.2011.49","10.1109/CCGrid.2011.49","Workload variations on Internet platforms such as YouTube, Flickr, LastFM require novel approaches to dynamic resource provisioning in order to meet QoS requirements, while reducing the Total Cost of Ownership (TCO) of the infrastructures. The economy of scale promise of cloud computing is a great opportunity to approach this problem, by developing elastic large scale server infrastructures. However, a proactive approach to dynamic resource provisioning requires prediction models forecasting future load patterns. On the other hand, unexpected volume and data spikes require reactive provisioning for serving unexpected surges in workloads. When workload can not be predicted, adequate data grouping and placement algorithms may facilitate agile scaling up and down of an infrastructure. In this paper, we analyze a dynamic workload of an on-line music portal and present an elastic Web infrastructure that adapts to workload variations by dynamically scaling up and down servers. The workload is predicted by an autoregressive model capturing trends and seasonal patterns. Further, for enhancing data locality, we propose a predictive data grouping based on the history of content access of a user community. Finally, in order to facilitate agile elasticity, we present a data placement based on workload and access pattern prediction. The experimental results demonstrate that our forecasting model predicts workload with a high precision. Further, the predictive data grouping and placement methods provide high locality, load balance and high utilization of resources, allowing a server infrastructure to scale up and down depending on workload.","elastic, prediction, cloud, data-grouping","","CCGRID '11"
"Conference Paper","Cavalcante E,Almeida A,Batista T,Cacho N,Lopes F,Delicato FC,Sena T,Pires PF","Exploiting Software Product Lines to Develop Cloud Computing Applications","2012","179–187","Association for Computing Machinery","New York, NY, USA","Proceedings of the 16th International Software Product Line Conference - Volume 2","Salvador, Brazil","2012","9781450310956","https://doi.org/10.1145/2364412.2364442;http://dx.doi.org/10.1145/2364412.2364442","10.1145/2364412.2364442","With the advance of the Cloud Computing paradigm, new challenges in terms of models, tools, and techniques to support developers to design, build and deploy complex software systems that make full use of the cloud technology arise. In the heterogeneous scenario of this new paradigm, the development of applications using cloud services becomes hard, and the software product lines (SPL) approach is potentially promising for this context since specificities of the cloud platforms, such as services heterogeneity, pricing model, and other aspects can be catered as variabilities to core features. In this perspective, this paper (i) proposes a seamless adaptation of the SPL-based development to include important features of cloud-based applications, and (ii) reports the experience of developing HW-CSPL, a SPL for the Health Watcher (HW) System, which allows citizens to register complaints and consult information regarding the public health system of a city. Several functionalities of this system were implemented using different Cloud Computing platforms, and run time specificities of this application deployed on the cloud were analyzed, as well as other information such as change impact and pricing.","health watcher system, cloud platforms, cloud computing, software product lines, services","","SPLC '12"
"Conference Paper","Wong P,He Z,Lo E","Parallel Analytics as a Service","2013","25–36","Association for Computing Machinery","New York, NY, USA","Proceedings of the 2013 ACM SIGMOD International Conference on Management of Data","New York, New York, USA","2013","9781450320375","https://doi.org/10.1145/2463676.2463714;http://dx.doi.org/10.1145/2463676.2463714","10.1145/2463676.2463714","Recently, massively parallel processing relational database systems (MPPDBs) have gained much momentum in the big data analytic market. With the advent of hosted cloud computing, we envision that the offering of MPPDB-as-a-Service (MPPDBaaS) will become attractive for companies having analytical tasks on only hundreds gigabytes to some ten terabytes of data because they can enjoy high-end parallel analytics at a cheap cost. This paper presents Thrifty, a prototype implementation of MPPDB-as-a-service. The major research issue is how to achieve a lower total cost of ownership by consolidating thousands of MPPDB tenants on to a shared hardware infrastructure, with a performance SLA that guarantees the tenants can obtain the query results as if they are executing their queries on dedicated machines. Thrifty achieves the goal by using a tenant-driven design that includes (1) a cluster design that carefully arranges the nodes in the cluster into groups and creates an MPPDB for each group of nodes, (2) a tenant placement that assigns each tenant to several MPPDBs (for high availability service through replication), and (3) a query routing algorithm that routes a tenant's query to the proper MPPDB at run-time. Experiments show that in a MPPDBaaS with 5000 tenants, where each tenant requests 2 to 32 nodes MPPDB to query against 200GB to 3.2TB of data, Thrifty can serve all the tenants with a 99.9% performance SLA guarantee and a high availability replication factor of 3, using only 18.7% of the nodes requested by the tenants.","cloud databases, multi-tenant databases, parallel databases, consolidation, database-as-a-service","","SIGMOD '13"
"Conference Paper","Kansal S,Singh G,Kumar H,Kaushal S","Pricing Models in Cloud Computing","2014","","Association for Computing Machinery","New York, NY, USA","Proceedings of the 2014 International Conference on Information and Communication Technology for Competitive Strategies","Udaipur, Rajasthan, India","2014","9781450332163","https://doi.org/10.1145/2677855.2677888;http://dx.doi.org/10.1145/2677855.2677888","10.1145/2677855.2677888","Cloud computing is one of the most promising computing models evolving from last decade in distributed computing. It has the capability of using services to allow the small Information Technology companies to rise in the market. With the growing use of cloud services number of companies has started entering in cloud market which includes cloud infrastructure providers. It has lead to the standardization of Application Programming Interfaces (API) and infrastructure. Optimal pricing of the services has become a major challenge for the cloud service providers. Various pricing models have evolved over the period. Some of these are the extended variants of Grid models whereas others completely new proposals. In this paper, various cloud service pricing issues along with recent models proposed in the literature have been reviewed. These models are classified into pay per use, subscription based and hybrid categories.","pricing model, static pricing, Cloud computing, dynamic pricing","","ICTCS '14"
"Conference Paper","Nguyen TA,Bimonte S,d'Orazio L,Darmont J","Cost Models for View Materialization in the Cloud","2012","47–54","Association for Computing Machinery","New York, NY, USA","Proceedings of the 2012 Joint EDBT/ICDT Workshops","Berlin, Germany","2012","9781450311434","https://doi.org/10.1145/2320765.2320788;http://dx.doi.org/10.1145/2320765.2320788","10.1145/2320765.2320788","In classical databases, query performance is casually achieved through physical data structures such as caches, indexes and materialized views. In this context, many cost models help select a ""best set"" of such data structures. However, this selection task becomes more complex in the cloud. The criterion to optimize is indeed at least two-dimensional, with the monetary cost of using the cloud balancing query response time. Thus, we define in this paper new cost models that fit into the pay-as-you-go paradigm of cloud computing. These cost models help achieve a multi-criteria optimization of the view materialization vs. CPU power consumption problem, under budget constraints. Finally, we present experimental results that provide a first validation of our contribution and show that cloud view materialization is always desirable.","performance and cost optimization, cost models, materialized views, cloud computing","","EDBT-ICDT '12"
"Conference Paper","Henzinger TA,Singh AV,Singh V,Wies T,Zufferey D","Static Scheduling in Clouds","2011","1","USENIX Association","USA","Proceedings of the 3rd USENIX Conference on Hot Topics in Cloud Computing","Portland, OR","2011","","","","Cloud computing aims to give users virtually unlimited pay-per-use computing resources without the burden of managing the underlying infrastructure. We present a new job execution environment Flextic that exploits scalable static scheduling techniques to provide the user with a flexible pricing model, such as a tradeoff between different degrees of execution speed and execution price, and at the same time, reduce scheduling overhead for the cloud provider. We have evaluated a prototype of Flextic on Amazon EC2 and compared it against Hadoop. For various data parallel jobs from machine learning, image processing, and gene sequencing that we considered, Flextic has low scheduling overhead and reduces job duration by up to 15% compared to Hadoop, a dynamic cloud scheduler.","","","HotCloud'11"
"Conference Paper","Hong YJ,Xue J,Thottethodi M","Dynamic Server Provisioning to Minimize Cost in an IaaS Cloud","2011","147–148","Association for Computing Machinery","New York, NY, USA","Proceedings of the ACM SIGMETRICS Joint International Conference on Measurement and Modeling of Computer Systems","San Jose, California, USA","2011","9781450308144","https://doi.org/10.1145/1993744.1993799;http://dx.doi.org/10.1145/1993744.1993799","10.1145/1993744.1993799","Cloud computing holds the exciting potential of elastically scaling computation to match time-varying demand, thus eliminating the need to provision for peak demand to satisfy response-time requirements. Moreover, cloud vendors often offer several commitment levels for their machine instances (e.g., users can choose to pay an upfront premium for the discounted hourly usage price). Because cost is a major concern that may limit the cloud adoption, two key challenges are to determine (a) the number of machines to provision and (b) the commitment level at which the machine instances should be acquired, to minimize cost while satisfying response-time targets. This paper address the above two challenges in an Infrastructure-as-a-Service (IaaS) cloud. Our simulations with real Web server load traces reveal that our techniques offer a cost reduction between 13% and 29% (21% on average) under Amazon EC2 pricing models.","cloud computing, capacity planning, dynamic provisioning","","SIGMETRICS '11"
"Conference Paper","Uriarte RB,Tiezzi F,Nicola R","SLAC: A Formal Service-Level-Agreement Language for Cloud Computing","2014","419–426","IEEE Computer Society","USA","Proceedings of the 2014 IEEE/ACM 7th International Conference on Utility and Cloud Computing","","2014","9781479978816","https://doi.org/10.1109/UCC.2014.53;http://dx.doi.org/10.1109/UCC.2014.53","10.1109/UCC.2014.53","The need of mechanisms to automate and regulate the interaction amongst the parties involved in the offered cloud services is exacerbated by the increasing number of providers and solutions that enable the cloud paradigm. This regulation needs to be defined through a contract, the so-called Service Level Agreement (SLA). We argue that the current solutions for SLA specification cannot cope with the distinctive characteristics of clouds. Therefore, in this paper we define a language, named SLAC, devised for specifying SLA for the cloud computing domain. The main differences with respect to the existing specification languages are: SLAC is domain specific, its semantics are formally defined in order to avoid ambiguity, it supports the main cloud deployment models, and it enables the specification of multi-party agreements. Moreover, SLAC supports the business aspects of the domain, such as pricing schemes, business actions and metrics. Furthermore, SLAC comes with an open-source software framework which enables the specification, evaluation and enforcement of SLAs for clouds. We illustrate potentialities and effectiveness of the SLAC language and its management framework by experimenting with an Open Nebula cloud system.","Constraint satisfaction problems, Formal Languages, Service Level Agreement, Cloud Computing","","UCC '14"
"Conference Paper","Nodari A,Nurminen JK,Frühwirth C","Inventory Theory Applied to Cost Optimization in Cloud Computing","2016","470–473","Association for Computing Machinery","New York, NY, USA","Proceedings of the 31st Annual ACM Symposium on Applied Computing","Pisa, Italy","2016","9781450337397","https://doi.org/10.1145/2851613.2851869;http://dx.doi.org/10.1145/2851613.2851869","10.1145/2851613.2851869","Cloud computing providers offer two different pricing schemes when renting virtual machines: reserved instances and on-demand instances. On-demand instances are paid only when utilized and they are useful to satisfy a fluctuating demand. Conversely, reserved instances are paid for a certain time period and are independent of usage. Since reserved instances require more commitment from users, they are cheaper than on-demand instances. However, in order to be cost-effective compared to on-demand instances, they have to be extensively utilized. This work focuses on finding the optimal combination of on-demand and reserved instances, such that the demand is satisfied and the costs minimized. To achieve this goal, this study introduces a stochastic model of the resources, based on Inventory Theory. The idea is to formulate the optimization problem as an inventory-keeping problem and then derive the optimal strategy. The paper evaluates the proposed model using data from an industry case, comparing the performance with a brute-force approach. The conducted experiments show that the Inventory Theory model provides accurate results and potentially allows prior research on Inventory Theory to be applied to optimal cloud provisioning.","cloud provisioning, cost optimization, resource allocation, inventory theory","","SAC '16"
