"Item type","Authors","Title","Publication year","Pages","Publisher","Address","Proceedings title","Conference location","Date published","ISBN","URLs","DOI","Abstract","Keywords","Sub-type","Series"
"Conference Paper","Kaulakienundefined D,Thomsen C,Pedersen TB,Çetintemel U,Kraska T","SpotADAPT: Spot-Aware (Re-)Deployment of Analytical Processing Tasks on Amazon EC2","2015","59–68","Association for Computing Machinery","New York, NY, USA","Proceedings of the ACM Eighteenth International Workshop on Data Warehousing and OLAP","Melbourne, Australia","2015","9781450337854","https://doi.org/10.1145/2811222.2811227;http://dx.doi.org/10.1145/2811222.2811227","10.1145/2811222.2811227","Having constantly increasing amounts of data, the analysis of it is often entrusted for a MapReduce framework. The execution of an analytical workload can be cheapened by adopting cloud computing resources, and in particular by using spot instances (cheap, fluctuating price instances) offered by Amazon Web Services (AWS). The users aiming for the spot market are presented with many instance types placed in multiple datacenters in the world, and thus it is difficult to choose the optimal deployment. In this paper, we propose the framework SpotADAPT (Spot-Aware (re-)Deployment of Analytical Processing Tasks) which is designed to help users by first, estimating the workload execution time on different AWS instance types, and, second, proposing the deployment (i.e., specific availability zone, instance type, pricing model) aligned with user-provided optimization goals (fastest or cheapest execution within boundaries). Moreover, during the execution of the workload, SpotADAPT suggests a redeployment if the current spot instance gets terminated by Amazon or a better deployment becomes possible due to fluctuations of the spot prices. The approach is evaluated using the actual execution times of typical analytical workloads and real spot price traces. SpotADAPT's suggested deployments are comparable to the theoretically optimal ones, and in particular, it shows good cost benefits for the budget optimization - on average SpotADAPT is at most 0.3% more expensive than the theoretically optimal deployments.","execution time estimation, ec2, spot instances, amazon web services, hadoop","","DOLAP '15"
"Conference Paper","Chen J,Wang C,Zhou BB,Sun L,Lee YC,Zomaya AY","Tradeoffs Between Profit and Customer Satisfaction for Service Provisioning in the Cloud","2011","229–238","Association for Computing Machinery","New York, NY, USA","Proceedings of the 20th International Symposium on High Performance Distributed Computing","San Jose, California, USA","2011","9781450305525","https://doi.org/10.1145/1996130.1996161;http://dx.doi.org/10.1145/1996130.1996161","10.1145/1996130.1996161","The recent cloud computing paradigm represents a trend of moving business applications to platforms run by parties located in different administrative domains. A cloud platform is often highly scalable and cost-effective through its pay-as-you-go pricing model. However, being shared by a large number of users, the running of applications in the platform faces higher performance uncertainty compared to a dedicated platform. Existing Service Level Agreements (SLAs) cannot sufficiently address the performance variation issue. In this paper, we use utility theory leveraged from economics and develop a new utility model for measuring customer satisfaction in the cloud. Based on the utility model, we design a mechanism to support utility-based SLAs in order to balance the performance of applications and the cost of running them. We consider an infrastructure-as-a-service type cloud platform (e.g., Amazon EC2), where a business service provider leases virtual machine (VM) instances with spot prices from the cloud and gains revenue by serving its customers. Particularly, we investigate the interaction of service profit and customer satisfaction. In addition, we present two scheduling algorithms that can effectively bid for different types of VM instances to make tradeoffs between profit and customer satisfaction. We conduct extensive simulations based on the performance data of different types of Amazon EC2 instances and their price history. Our experimental results demonstrate that the algorithms perform well across the metrics of profit, customer satisfaction and instance utilization.","service level agreement, scheduling, customer satisfaction, utility theory","","HPDC '11"
"Conference Paper","Besbes O,Elmachtoub AN,Sun Y","Static Pricing: Universal Guarantees for Reusable Resources","2019","393–394","Association for Computing Machinery","New York, NY, USA","Proceedings of the 2019 ACM Conference on Economics and Computation","Phoenix, AZ, USA","2019","9781450367929","https://doi.org/10.1145/3328526.3329585;http://dx.doi.org/10.1145/3328526.3329585","10.1145/3328526.3329585","We consider a fundamental pricing model in which a fixed number of units of a reusable resource are used to serve customers. Customers arrive to the system according to a stochastic process and upon arrival decide whether or not to purchase the service, depending on their willingness-to-pay and the current price. The service time during which the resource is used by the customer is stochastic and the firm may incur a service cost. This model represents various markets for reusable resources such as cloud computing, shared vehicles, rotable parts, and hotel rooms. In the present paper, we analyze this pricing problem when the firm attempts to maximize a weighted combination of three central metrics: profit, market share, and service level. Under Poisson arrivals, exponential service times, and standard assumptions on the willingness-to-pay distribution, we establish a series of results that characterize the performance of static pricing in such environments. In particular, while an optimal policy is fully dynamic in such a context, we prove that a static pricing policy simultaneously guarantees 78.9% of the profit, market share, and service level from the optimal policy. Notably, this result holds for any service rate and number of units the firm operates. In the special case where there are two units and the induced demand is linear, we also prove that the static policy guarantees 95.5% of the profit from the optimal policy. Our numerical findings on a large testbed of instances suggest that the latter result is quite indicative of the profit obtained by the static pricing policy across all parameters.","static pricing, reusable resources, dynamic pricing","","EC '19"
"Conference Paper","Mathew A,Andrikopoulos V,Blaauw FJ","Exploring the Cost and Performance Benefits of AWS Step Functions Using a Data Processing Pipeline","2021","","Association for Computing Machinery","New York, NY, USA","Proceedings of the 14th IEEE/ACM International Conference on Utility and Cloud Computing","Leicester, United Kingdom","2021","9781450385640","https://doi.org/10.1145/3468737.3494084;http://dx.doi.org/10.1145/3468737.3494084","10.1145/3468737.3494084","In traditional cloud computing, dedicated hardware is substituted by dynamically allocated, utility-oriented resources such as virtualized servers. While cloud services are following the pay-as-you-go pricing model, resources are billed based on instance allocation and not on the actual usage, leading the customers to be charged needlessly. In serverless computing, as exemplified by the Function-as-a-Service (FaaS) model where functions are the basic resources, functions are typically not allocated or charged until invoked or triggered. Functions are not applications, however, and to build compelling serverless applications they frequently need to be orchestrated with some kind of application logic. A major issue emerging by the use of orchestration is that it complicates further the already complex billing model used by FaaS providers, which in combination with the lack of granular billing and execution details offered by the providers makes the development and evaluation of serverless applications challenging.Towards shedding some light into this matter, in this work we extensively evaluate the state-of-the-art function orchestrator AWS Step Functions (ASF) with respect to its performance and cost. For this purpose we conduct a series of experiments using a serverless data processing pipeline application developed as both ASF Standard and Express workflows. Our results show that Step Functions using Express workflows are economical when running short-lived tasks with many state transitions. In contrast, Standard workflows are better suited for long-running tasks, offering in addition detailed debugging and logging information. However, even if the behavior of the orchestrated AWS Lambda functions influences both types of workflows, Step Functions realized as Express workflows get impacted the most by the phenomena affecting Lambda functions.","serverless performance, AWS step functions, AWS lambda, function-as-a-service (FaaS), serverless, serverless cost","","UCC '21"
"Book","","CloudDB '10: Proceedings of the Second International Workshop on Cloud Data Management","2010","","Association for Computing Machinery","New York, NY, USA","","Toronto, ON, Canada","2010","9781450303804","","","It is our great pleasure to welcome you to the Second International Workshop on Cloud Data Management (CloudDB 2010). Cloud computing is set to revolutionize the IT industry, and database services are at the core of cloud computing since most information systems are built on database services. Cloud data management holds many promises and challenges. CloudDB 2010 is intended to address the challenges of large-scale data management based on cloud computing infrastructure. This workshop brings together researchers and practitioners in cloud computing and data-intensive system designs, parallel algorithms, data management, scientific applications, and information-based applications to maximize performance, minimize cost and improve the scale of their endeavors.This workshop attracted 11 submissions from Asia, Europe, and North America. Due to the high quality of the submissions received, the program committee decided to accept 8 full papers. These papers cover a variety of topics, including cloud data security, cloud data management and cloud system applications. We hope that they will serve as a valuable starting point for much brilliant thinking in cloud data management.Paper ""Towards a Data-centric View of Cloud Security"" discusses data management challenges in the areas of secure distributed query processing, system analysis and forensics, and query correctness assurance. Zhou et al. proposed a data-centric view of cloud security.Paper ""ESQP: An Efficient SQL Query Processing for Cloud Data Management"" by Zhao et al. proposed an efficient algorithm about query processing on structured data. They also demonstrated the efficiency and scalability of the algorithm with kinds of experiments.In the paper ""Benchmarking Cloud-based Data Management Systems"", Shi et al. conducted comprehensive experiments on several representative cloud-based data management systems to explore relative performance of different implementation approaches. In the paper ""Towards Bipartite Graph Data Management"", Zhao et al. fully studied the BGDM and developed a logic graph structure for indexing bipartite graphs to improve common operations efficiently.In ""Contract-based Cloud Architecture"", Alnemr et al. studied several issues such as security and legality that should be considered before entering the cloud. They showed that companies have to comply with diverse laws across jurisdictions and are accountable to various national regulators. Security requirements may not be compatible with those offered by existing providers.In the paper ""Comparing SQL and MapReduce to Compute Naive Bayes in a Single Table Scan"", Ordonez et al. presented some novel techniques to handle the data mining which is performed on flat files inside the DBMS, and considered two phases of the classifier: building the model and scoring a new data set.In the paper ""Adaptive Query Execution for Data Management in the Cloud"", Popescu et al. focused on analyzing the ""light"" queries processed on the cloud by using an adaptive scheme, which uses a cost model to switch between MapReduce and a DBMS.In the paper ""Dynamic Data Replication through Virtualization"", Daudjee et al. investigated data replication in a virtualized environment, focused on how to provision services when the master database server is heavily loaded or when it fails.","","Proceedings",""
